### ISSUE TITLE
non-latin types, buckets, and keys

### ISSUE THREAD

**Issue by rzezeski** [basho/yokozuna#359]
A Riak Test should be written to verify that Yokozuna works with types, buckets, and keys which contain non-latin characters. There are tests for non-latin object values in `yz_languages.erl` but AFAIK there are no tests for types, buckets, and keys.

I thought of this while looking at the diff for #358 which performs a `binary_to_list` on object key.

**Comment by cmeiklejohn** [comment]
Moving to feature.

**Comment by kellymclaughlin** [comment]
This turns out to have been a really good idea to test. I have a test written on the `feature/non-latin1-type-bucket-key-test` branch and I am seeing an issue with index names that use a charset of something other than ISO-8859-1. If I use an index with characters from ISO-8859-6 or ISO-8859-8 and a content type of _text/plain_ then I receive the following error in the Riak console log:

```
2014-05-06 06:43:58.826 [error] <0.479.0>@yz_index:local_create:193 Couldn't create index ¿¤×: {ok,"400",[{"Content-Type","text/html;charset=ISO-8859-1"},{"Cache-Control","must-revalidate,no-cache,no-store"},{"Content-Length","1629"}],<<"<html>\n<head>\n<meta http-equiv=\"Content-Type\" content=\"text/html; charset=ISO-8859-1\"/>\n<title>Error 400 {msg=URLDecoder: Invalid character encoding detected after position 19 of query string / form data (while parsing as UTF-8),code=400}</title>\n</head>\n<body><h2>HTTP ERROR 400</h2>\n<p>Problem accessing /solr/admin/cores. Reason:\n<pre>    {msg=URLDecoder: Invalid character encoding detected after position 19 of query string / form data (while parsing as UTF-8),code=400}</pre></p><hr /><i><small>Powered by Jetty://</small></i><br/>                                                \n<br/>                                                \n<br/>                                                \n<br/>                                                \n<br/>                                                \n<br/>                                                \n<br/>                                                \n<br/>                                                \n<br/>                                                \n<br/>                                                \n<br/>                                                \n<br/>                                                \n<br/>                                                \n<br/>                                                \n<br/>                                                \n<br/>                                                \n<br/>                                                \n<br/>                                                \n<br/>                                                \n<br/>                                                \n\n</body>\n</html>\n">>}
```

If I add the appropriate _charset_ specification to the content type (_e.g._ `text/plain; charset=ISO-8859-6`) then the index creation works, but I get a `406 Not Acceptable` error from Riak when the test attempts to fetch a stored document because it uses the charset in the Accept header and the Riak webmachine resources probably do not handle this. Here the tcpdump capture that illustrates the error:

```
07:02:45.686486 IP (tos 0x0, ttl 64, id 1580, offset 0, flags [DF], proto TCP (6), length 184, bad cksum 0 (->3612)!)
    localhost.57604 > localhost.10018: Flags [P.], cksum 0xfeac (incorrect -> 0xc05c), seq 1:133, ack 1, win 17352, options [nop,nop,TS val 899366219 ecr 899366219], length 132
    0x0000:  4500 00b8 062c 4000 4006 0000 7f00 0001  E....,@.@.......
    0x0010:  7f00 0001 e104 2722 5d9c fe0e 0684 52fc  ......'"].....R.
    0x0020:  8018 43c8 feac 0000 0101 080a 359b 3d4b  ..C.........5.=K
    0x0030:  359b 3d4b 4745 5420 2f74 7970 6573 2f46  5.=KGET./types/F
    0x0040:  4839 2f62 7563 6b65 7473 2f2f 4448 2f6b  H9/buckets//DH/k
    0x0050:  6579 732f 4541 2a27 2d20 4854 5450 2f31  eys/EA*'-.HTTP/1
    0x0060:  2e31 0d0a 6163 6365 7074 3a20 7465 7874  .1..accept:.text
    0x0070:  2f70 6c61 696e 3b20 6368 6172 7365 743d  /plain;.charset=
    0x0080:  4953 4f2d 3838 3539 2d36 0d0a 486f 7374  ISO-8859-6..Host
    0x0090:  3a20 3132 372e 302e 302e 313a 3130 3031  :.127.0.0.1:1001
    0x00a0:  380d 0a43 6f6e 7465 6e74 2d4c 656e 6774  8..Content-Lengt
    0x00b0:  683a 2030 0d0a 0d0a                      h:.0....
07:02:45.686498 IP (tos 0x0, ttl 64, id 828, offset 0, flags [DF], proto TCP (6), length 52, bad cksum 0 (->3986)!)
    localhost.10018 > localhost.57604: Flags [.], cksum 0xfe28 (incorrect -> 0x7576), ack 133, win 24481, options [nop,nop,TS val 899366219 ecr 899366219], length 0
    0x0000:  4500 0034 033c 4000 4006 0000 7f00 0001  E..4.<@.@.......
    0x0010:  7f00 0001 2722 e104 0684 52fc 5d9c fe92  ....'"....R.]...
    0x0020:  8010 5fa1 fe28 0000 0101 080a 359b 3d4b  .._..(......5.=K
    0x0030:  359b 3d4b                                5.=K
07:02:45.698320 IP (tos 0x0, ttl 64, id 35897, offset 0, flags [DF], proto TCP (6), length 235, bad cksum 0 (->afd1)!)
    localhost.10018 > localhost.57604: Flags [P.], cksum 0xfedf (incorrect -> 0xd179), seq 1:184, ack 133, win 24481, options [nop,nop,TS val 899366231 ecr 899366219], length 183
    0x0000:  4500 00eb 8c39 4000 4006 0000 7f00 0001  E....9@.@.......
    0x0010:  7f00 0001 2722 e104 0684 52fc 5d9c fe92  ....'"....R.]...
    0x0020:  8018 5fa1 fedf 0000 0101 080a 359b 3d57  .._.........5.=W
    0x0030:  359b 3d4b 4854 5450 2f31 2e31 2034 3036  5.=KHTTP/1.1.406
    0x0040:  204e 6f74 2041 6363 6570 7461 626c 650d  .Not.Acceptable.
    0x0050:  0a53 6572 7665 723a 204d 6f63 6869 5765  .Server:.MochiWe
    0x0060:  622f 312e 3120 5765 624d 6163 6869 6e65  b/1.1.WebMachine
    0x0070:  2f31 2e31 302e 3520 286a 6f6b 6573 2061  /1.10.5.(jokes.a
    0x0080:  7265 2062 6574 7465 7220 6578 706c 6169  re.better.explai
    0x0090:  6e65 6429 0d0a 4461 7465 3a20 5475 652c  ned)..Date:.Tue,
    0x00a0:  2030 3620 4d61 7920 3230 3134 2031 333a  .06.May.2014.13:
    0x00b0:  3032 3a34 3520 474d 540d 0a43 6f6e 7465  02:45.GMT..Conte
    0x00c0:  6e74 2d54 7970 653a 2074 6578 742f 6874  nt-Type:.text/ht
    0x00d0:  6d6c 0d0a 436f 6e74 656e 742d 4c65 6e67  ml..Content-Leng
    0x00e0:  7468 3a20 3136 350d 0a0d 0a              th:.165....
07:02:45.698339 IP (tos 0x0, ttl 64, id 57665, offset 0, flags [DF], proto TCP (6), length 217, bad cksum 0 (->5adb)!)
    localhost.10018 > localhost.57604: Flags [P.], cksum 0xfecd (incorrect -> 0x7396), seq 184:349, ack 133, win 24481, options [nop,nop,TS val 899366231 ecr 899366219], length 165
    0x0000:  4500 00d9 e141 4000 4006 0000 7f00 0001  E....A@.@.......
    0x0010:  7f00 0001 2722 e104 0684 53b3 5d9c fe92  ....'"....S.]...
    0x0020:  8018 5fa1 fecd 0000 0101 080a 359b 3d57  .._.........5.=W
    0x0030:  359b 3d4b 3c68 746d 6c3e 3c68 6561 643e  5.=K<html><head>
    0x0040:  3c74 6974 6c65 3e34 3036 204e 6f74 2041  <title>406.Not.A
    0x0050:  6363 6570 7461 626c 653c 2f74 6974 6c65  cceptable</title
    0x0060:  3e3c 2f68 6561 643e 3c62 6f64 793e 3c68  ></head><body><h
    0x0070:  313e 4e6f 7420 4163 6365 7074 6162 6c65  1>Not.Acceptable
    0x0080:  3c2f 6831 3e4e 6f74 2041 6363 6570 7461  </h1>Not.Accepta
    0x0090:  626c 653c 703e 3c68 723e 3c61 6464 7265  ble<p><hr><addre
    0x00a0:  7373 3e6d 6f63 6869 7765 622b 7765 626d  ss>mochiweb+webm
    0x00b0:  6163 6869 6e65 2077 6562 2073 6572 7665  achine.web.serve
    0x00c0:  723c 2f61 6464 7265 7373 3e3c 2f62 6f64  r</address></bod
    0x00d0:  793e 3c2f 6874 6d6c 3e                   y></html>
```

The next step is to make changes to the Riak webmachine resources to better handle different charset specifications in Accept headers and determine if that causes the test to pass. I will then open a PR for the new test case and another PR for any change required to the webmachine resources.

**Comment by kellymclaughlin** [comment]
I made a bit more progress on this test and now have it working for both arabic and hebrew characters in the bucket type, bucket, key, and index names. It is still not working for japanese characters apparently because they are not UTF-8. I get the following failure when trying to use them:

```
2014-05-08 15:08:11.433 [error] <0.479.0>@yz_index:local_create:193 Couldn't create index 0¿0¤0×: {ok,"400",[{"Content-Type","text/html;charset=ISO-8859-1"},{"Cache-Control","must-revalidate,no-cache,no-store"},{"Content-Length","1629"}],<<"<html>\n<head>\n<meta http-equiv=\"Content-Type\" content=\"text/html; charset=ISO-8859-1\"/>\n<title>Error 400 {msg=URLDecoder: Invalid character encoding detected after position 19 of query string / form data (while parsing as UTF-8),code=400}</title>\n</head>\n<body><h2>HTTP ERROR 400</h2>\n<p>Problem accessing /solr/admin/cores. Reason:\n<pre>    {msg=URLDecoder: Invalid character encoding detected after position 19 of query string / form data (while parsing as UTF-8),code=400}</pre></p><hr /><i><small>Powered by Jetty://</small></i><br/>                                                \n<br/>                                                \n<br/>                                                \n<br/>                                                \n<br/>                                                \n<br/>                                                \n<br/>                                                \n<br/>                                                \n<br/>                                                \n<br/>                                                \n<br/>                                                \n<br/>                                                \n<br/>                                                \n<br/>                                                \n<br/>                                                \n<br/>                                                \n<br/>                                                \n<br/>                                                \n<br/>                                                \n<br/>                                                \n\n</body>\n</html>\n">>}
```

At this point I am unsure of how to make the japanese test case work. Maybe specifying the character set with the content-type in the solr request to create the index would work, but currently there is no way plumbed through the yz api to pass custom headers with an index creation request. My feeling is that further investigation and work on this can wait until after 2.0 is released. I commented out the japanese test case so the test is functional and passing as it stands on the `feature/non-latin1-type-bucket-key-test` branch and I am happy to make a PR for that and then I can open an issue to address the issue with the japanese test case at a later date.

Thoughts?

**Comment by shino** [comment]
Sorry for stepping in.
I don't know the details of YZ implementation and the test, so please correct me if I say totally-unrelated things :open_mouth:  

> It is still not working for japanese characters apparently because they are not UTF-8.

Japanese characters can be expressed by UTF-8 or UTF-16 or something else (but not anything).
For example, Katakana-Ta "タ" is encoded as `0xE3 0x82 0xBF` in UTF-8 and `0x30BF` in UTF-16.
cf. http://www.fileformat.info/info/unicode/char/30bf/index.htm

**Comment by rzezeski** [comment]
@kellymclaughlin My understanding is that `content-type` has no
bearing on the decoding of the URI.  Furthermore, RFC-3986 appears to
indicate that any characters in UCS [1] which are not ASCII should be
encoded internally as UTF-8 and then percent encoded [2].  Using
@shino's example:

```
1> S = "タ".
[12479]
2> B = unicode:characters_to_binary(S).
<<227,130,191>>
3> io:format("~.16B ~.16B ~.16B~n", binary_to_list(B)).
E3 82 BF
4> mochiweb_util:quote_plus(B).
"%E3%82%BF"
```

Furthermore, Solr will only work with data encoded in UTF-8 format so
it makes sense to use UTF-8 across the board.

My original intention for creating this issue is because I know, for a
fact, that Yokozuna cannot handle index names with characters that are
outside the 7-bin ASCII range.  I know this because it still uses
`binary_to_list` in some areas.  Furthermore, there may be other
places where Yokozuna cannot handle non-ascii characters.  We have
tests to verify that it works with riak object values containing
UTF-8, and I have a pending PR which fixes handling of keys with
non-ascii [3], but tests should be written for bucket types with
non-ascii.  I know @macintux has done quite a bit of work in this area
but Yokozuna may do some of its own internal handling of type names
and I want to make sure we don't garble the encoding.

Allowing index names to contain non-ascii may open a Pandora's box as
Solr will create a file system directory based on that name.  There
are many combinations of file systems and operating systems a user may
run.  How do the majority of them handle non-ascii file names?
Should we care?  Should we just allow non-ascii and it's up to the
user to make sure their OS plays nice?

[1]: http://en.wikipedia.org/wiki/Universal_Character_Set
[2]: http://tools.ietf.org/html/rfc3986#section-2.5
[3]: https://github.com/basho/yokozuna/pull/371

**Comment by macintux** [comment]
Much like bucket types or usernames, it's not clear to me that we can readily recover from supporting latin1 and not utf-8, since I'm not sure we'll be able to fix things in the future without breaking latin1 names that have been previously used.

I'll take a closer look to see if there's anything I can do to help. Will probably need some YZ bootstrapping to assist effectively.

**Comment by macintux** [comment]
Re: filesystem support, there's an interesting list of filesystem issues: http://www.j3e.de/linux/convmv/man/

**Comment by macintux** [comment]
Gut feeling from reviewing that link and general browsing is that utf-8 will just work unless sysadmins do really wonky things. It should be trivial to give them a tool that creates and reads utf-8 files the way we do so they can test their setup.

Given the short timeframe until 2.0, I would suggest we actively enforce ASCII for index names instead of tacitly allowing latin-1, and target full UTF-8 support later.

**Comment by macintux** [comment]
PR #381 for locking down index names to ascii

**Comment by rzezeski** [comment]
So #381 constrains index names to ASCII.

I've made 2 PRs which use a single unicode character (λ) in type, bucket and key name.  As I suspected it didn't work because of bugs in Yokozuna.  Those bugs have been addressed in these merged PRs:

https://github.com/basho/yokozuna/pull/371/files#diff-fcd3eac1920e92dfb506f0809a528264R29
https://github.com/basho/yokozuna/pull/385/files#diff-f9f0e102b2a5208f41b2f304ada0ee5cR127

I think that only leaves schema names untested.  All schemas are stored in cluster meta and at first glance it never touches the name, of type binary, between the user and insertion into cluster meta.  It would be worthwhile to add a test but considering other things already targeted for 2.0RC I think it's something that can wait.

**Comment by rzezeski** [comment]
I created a separate issue for unicode + schema names.  I'm closing this issue as my original goals have been accomplished.  But don't let that stop you, the people, from creating other unicode tests against Yokozuna to keep me honest. :smile:
